{
  "meta": {
    "style": "list",
    "brand": "default",
    "topic": "5 sinais que você precisa trocar de emprego",
    "count": 5,
    "generated_at": "2026-04-04T21:30:00Z"
  },
  "caption": "Ninguém acorda num dia e decide sair do emprego. Geralmente é uma soma de pequenos sinais ignorados por meses. Aqui estão 5 que se repetem em quase toda conversa de transição de carreira. Qual desses você reconheceu?",
  "hashtags": ["carreira", "empregos", "trabalho", "rh", "desenvolvimentoprofissional", "transicaodecarreira", "lideranca"],
  "slides": [
    {
      "index": 1,
      "variant": "card",
      "role": "cover",
      "titulo": "5 SINAIS PRA TROCAR DE EMPREGO",
      "texto": "O seu corpo sabe antes do seu currículo. Confere se bate.",
      "destaque": "5 SINAIS"
    },
    {
      "index": 2,
      "variant": "card",
      "role": "item",
      "number": 1,
      "titulo": "Domingo à noite virou ansiedade",
      "texto": "Se você dorme mal na noite anterior à segunda-feira há mais de 3 meses, o problema não é a semana — é o trabalho.",
      "destaque": "3 meses"
    },
    {
      "index": 3,
      "variant": "card",
      "role": "item",
      "number": 2,
      "titulo": "Você parou de aprender",
      "texto": "Há 6 meses sem skill nova, sem desafio real, sem conversa técnica difícil. Zona de conforto é zona de desvalorização.",
      "destaque": "zona de desvalorização"
    },
    {
      "index": 4,
      "variant": "card",
      "role": "item",
      "number": 3,
      "titulo": "Seu chefe não defende o time",
      "texto": "Em reunião com diretoria, suas entregas viram 'culpa do time' e os méritos viram 'estratégia da liderança'. Isso é sinal estrutural.",
      "destaque": "sinal estrutural"
    },
    {
      "index": 5,
      "variant": "card",
      "role": "item",
      "number": 4,
      "titulo": "Você esconde que trabalha aí",
      "texto": "Em conversa social, você fala vago sobre o emprego. Vergonha do lugar é o último estágio antes de pedir demissão.",
      "destaque": "último estágio"
    },
    {
      "index": 6,
      "variant": "card",
      "role": "item",
      "number": 5,
      "titulo": "O salário é o único motivo",
      "texto": "Se tirar o dinheiro e sobrar vazio, você não tem emprego — tem aluguel caro. E aluguel caro sempre encontra alternativa.",
      "destaque": "aluguel caro"
    },
    {
      "index": 7,
      "variant": "card",
      "role": "outro",
      "titulo": "QUAL SINAL BATEU COM VOCÊ?",
      "texto": "Comenta o número. Às vezes colocar em palavras já é o primeiro passo.",
      "destaque": "QUAL SINAL"
    }
  ]
}
